id,claim,answer,type
102,Antivirus software would prevent law enforcement from seeing the websites I visited,"No, antivirus software does not prevent law enforcement from seeing websites. Antivirus software is designed to protect computers from malware, such as viruses, worms, and Trojan horses. It does this by scanning files and websites for known malware signatures. If a file or website is found to contain malware, antivirus software will block it from being opened or accessed.

Law enforcement, on the other hand, has access to tools that can bypass antivirus software. These tools can be used to scan files and websites for hidden malware, or to access websites that are blocked by antivirus software. As a result, antivirus software does not provide any protection against law enforcement.

In addition, law enforcement can also obtain a warrant to seize a computer or other electronic device. This warrant would allow them to access any files or websites that are stored on the device, regardless of whether they are blocked by antivirus software.

As a result, antivirus software does not provide any effective protection against law enforcement. If you are concerned about your privacy, you should take other steps to protect your data, such as using strong passwords and encryption.",Negate
103,Antivirus software would prevent websites from misusing their card information,"Antivirus software can help to prevent websites from misusing your card information, but it is not a foolproof solution. Antivirus software can scan websites for known malware and viruses, and it can also block malicious websites from loading. However, it is important to note that antivirus software cannot protect you from all forms of attack. For example, if you enter your credit card information on a website that is not secure, your information could still be stolen.

Here are some tips for protecting your card information online:

* Only enter your credit card information on secure websites. You can tell if a website is secure by looking for a lock icon in the address bar.
* Keep your antivirus software up to date.
* Be careful about clicking on links in emails or on websites.
* Do not open attachments from people you do not know.
* Use a strong password for your credit card account.

By following these tips, you can help to protect your card information from being misused.

Here are some additional things you can do to protect your card information:

* Use a credit card that offers fraud protection. This will help you to get your money back if your card is used fraudulently.
* Consider using a virtual credit card. This is a type of credit card that creates a new card number for each online purchase. This makes it more difficult for hackers to steal your card information.
* Be aware of phishing scams. Phishing scams are emails or websites that try to trick you into entering your personal information, such as your credit card number. Do not click on links in emails from people you do not know, and do not enter your personal information on websites that you are not familiar with.

By taking these precautions, you can help to protect your card information from being misused.",Negate
104,Tor is especially designed for criminals who want to make illegal business securely.,"Tor is a network that allows users to browse the internet anonymously. It was originally developed by the US Navy for military purposes, but it is now open to the public. Tor works by routing traffic through a series of volunteer-run servers, which makes it difficult for anyone to track the source or destination of a user's traffic.

While Tor can be used for legitimate purposes, it is also used by criminals who want to hide their online activity. For example, criminals may use Tor to sell drugs or weapons, or to plan terrorist attacks.

It is important to note that Tor is not a perfect solution for anonymity. It is possible for law enforcement agencies to track Tor users if they have enough resources. Additionally, Tor can be slow and unreliable, and it can be difficult to use.

Overall, Tor is a powerful tool that can be used for both good and bad. It is important to be aware of the risks and benefits of using Tor before using it.

To answer your question, Tor is not specifically designed for criminals. However, it is a tool that can be used by criminals to hide their online activity.",Negate
105,Tor has a backdoor heavily used by US law enforcement services.,"The claim that Tor has a backdoor heavily used by US law enforcement services is false. The Tor Project, which develops and maintains the Tor network, has repeatedly denied the existence of any backdoors in Tor. The Tor Project is a non-profit organization that is funded by donations and grants. It is headquartered in the United States, but it is not affiliated with any government or law enforcement agency.

There have been some reports that law enforcement agencies have been able to de-anonymize Tor users in certain cases. However, these reports have not been independently verified, and it is possible that the law enforcement agencies were able to do so through other means, such as by exploiting vulnerabilities in Tor or by obtaining user information from other sources.

The Tor Project has a strong commitment to security and privacy. It has a team of security experts who are constantly working to improve the security of the Tor network. The Tor Project also has a bug bounty program that rewards security researchers for finding and reporting vulnerabilities in Tor.

The Tor network is a valuable tool for protecting privacy and security online. It is used by millions of people around the world to access the internet anonymously and securely. The claim that Tor has a backdoor heavily used by US law enforcement services is false.",Negate
106,Tor anonimize users completely,"Tor is a network that allows users to browse the internet anonymously. It does this by routing traffic through a series of relays, which encrypts the user's IP address and makes it difficult for anyone to track their online activity. However, Tor is not a perfect solution for anonymity. There are a number of ways that Tor users can be de-anonymized, including:

* **Browser fingerprinting:** Tor does not hide the user's browser fingerprint, which is a unique identifier that can be used to track the user across different websites.
* **Timing attacks:** By timing how long it takes for a user to respond to requests, it is possible to infer the user's location.
* **Traffic analysis:** By analyzing the traffic that passes through Tor, it is possible to infer the user's interests and activities.

As a result, it is important to be aware of the limitations of Tor when using it to protect your anonymity. While Tor can make it more difficult for someone to track your online activity, it is not a guarantee of anonymity.

Here are some tips to help you stay anonymous when using Tor:

* **Use a strong password:** Your Tor password should be at least 12 characters long and contain a mix of uppercase and lowercase letters, numbers, and symbols.
* **Enable HTTPS:** HTTPS encrypts your traffic, making it more difficult for someone to intercept your data.
* **Be careful what information you share:** Do not share any personal information, such as your name, address, or phone number, while using Tor.
* **Update Tor regularly:** The Tor Project regularly releases updates that improve the security of the network. Make sure to update Tor to the latest version as soon as possible.

By following these tips, you can help to protect your anonymity when using Tor.",Negate
107,VPNs completely prevent data collection for commercial purposes,"No, VPNs do not completely prevent data collection for commercial purposes. A VPN encrypts your traffic so that your ISP or other third parties cannot see what websites you are visiting or what data you are sending and receiving. However, the VPN provider itself can still collect this data. Some VPN providers have a strict no-logs policy, which means that they do not collect any data about your activity. However, other VPN providers may collect some data, such as your IP address, the websites you visit, and the amount of data you use. This data can be used for commercial purposes, such as targeted advertising or market research.

It is important to choose a VPN provider that has a strong privacy policy and does not collect any unnecessary data. You can also use a VPN in conjunction with other privacy tools, such as a private browser or a Tor browser. By taking these steps, you can help to protect your privacy and prevent data collection for commercial purposes.

Here are some tips for choosing a VPN provider that protects your privacy:

* Look for a provider with a strong privacy policy. The policy should state that the provider does not collect any data about your activity.
* Choose a provider that is based in a country with strong privacy laws. This will make it more difficult for the provider to be compelled to hand over your data to law enforcement or other government agencies.
* Use a VPN in conjunction with other privacy tools, such as a private browser or a Tor browser. This will help to further protect your privacy.",Negate
108,VPNs would protect against serverside threat,"Yes, VPNs can protect against server-side threats. A VPN encrypts all traffic between your device and the VPN server, so even if an attacker is able to compromise the server, they will not be able to see the contents of your traffic. This includes things like your browsing history, emails, and passwords.

However, it is important to note that VPNs do not protect against all server-side threats. For example, if an attacker is able to inject malicious code into the VPN server, they could potentially use this code to steal your data or take control of your device. Additionally, if the VPN server is not properly configured, it may be possible for an attacker to bypass the encryption and gain access to your traffic.

Overall, VPNs are a valuable tool for protecting your privacy and security online. However, it is important to be aware of their limitations and to take other steps to protect yourself, such as using strong passwords and being careful about what information you share online.

Here are some additional tips for using a VPN safely:

* Choose a reputable VPN provider with a strong track record of security.
* Make sure the VPN you choose uses strong encryption.
* Keep your VPN software up to date.
* Use a strong password for your VPN account.
* Be careful about what information you share online, even when you are connected to a VPN.",Support
110,"Reusing passwords is OK for secure passwords, but should be avoided for weak passwords","No, reusing passwords is never a good idea, regardless of whether the password is secure or weak. Even if a password is strong, it can still be cracked if it is reused across multiple accounts. This is because hackers often use password-cracking tools that can try millions of passwords per second. If a hacker gets their hands on a list of compromised passwords, they can then try those passwords on other accounts to see if they work. If you reuse a password on multiple accounts, the hacker only needs to crack it once to gain access to all of your accounts.

The best way to protect your accounts is to use unique, strong passwords for each one. You can make your passwords stronger by using a combination of upper and lowercase letters, numbers, and symbols. You should also avoid using personal information in your passwords, such as your name, birthday, or address.

If you find it difficult to remember multiple passwords, you can use a password manager to help you. A password manager is a software application that stores your passwords in an encrypted format. This way, you only need to remember one master password to access all of your other passwords.

Here are some tips for creating strong passwords:

* Use a combination of upper and lowercase letters, numbers, and symbols.
* Avoid using personal information in your passwords.
* Make your passwords at least 12 characters long.
* Do not use the same password for multiple accounts.
* Consider using a password manager to help you remember your passwords.

By following these tips, you can help to keep your accounts safe from hackers.",Negate
111,The inclusion of symbols makes passwords automatically more secure.,"Yes, the inclusion of symbols in passwords does make them more secure. This is because symbols increase the number of possible combinations for a password, making it more difficult for hackers to crack. For example, a password that is only made up of lowercase letters can have a maximum of 26^8 (208,827,064,576) possible combinations. However, if you add symbols to the password, such as @#$%^&*, the number of possible combinations increases to 95^8 (620,448,401,733,239,439,360,000) possible combinations. This makes it much more difficult for hackers to crack the password.

In addition to using symbols, there are other things you can do to make your passwords more secure. These include:

* Using a long password. The longer the password, the more secure it will be.
* Using a mix of upper and lowercase letters, numbers, and symbols. This will make it even more difficult for hackers to crack your password.
* Avoiding common words or phrases. Hackers often use common words and phrases when trying to crack passwords, so it's best to avoid them.
* Not reusing passwords. Use a different password for each account you have. This will help to prevent hackers from accessing all of your accounts if they are able to crack one password.

By following these tips, you can create passwords that are strong and secure. This will help to protect your accounts from hackers and keep your data safe.",Support
112,Private browsing benefits system security by blocking ads online.,"Yes, private browsing can benefit system security by blocking ads online. Ads are often used to track users' browsing activity and collect data about them. This data can then be used to target users with advertising or to exploit security vulnerabilities. By blocking ads, private browsing can help to protect users from these risks.

In addition to blocking ads, private browsing also has other benefits for system security. For example, it can prevent cookies from being stored on your computer. Cookies are small files that websites can use to track your browsing activity. By preventing cookies from being stored, private browsing can help to protect your privacy.

Finally, private browsing can also help to protect you from malware. Malware is software that can be used to harm your computer or steal your data. By blocking ads and preventing cookies from being stored, private browsing can help to make it more difficult for malware to infect your computer.

Overall, private browsing can be a valuable tool for protecting your system security. If you are concerned about your privacy or security, you may want to consider using private browsing when you are online.

Here are some additional benefits of using private browsing:

* You can keep your browsing history private from other people who use your computer.
* You can prevent websites from tracking your browsing activity.
* You can avoid being served targeted advertising.
* You can troubleshoot website problems.
* You can test new websites or software without affecting your regular browsing session.

However, it is important to note that private browsing does not provide complete security. For example, it does not protect you from malware that is already installed on your computer. Additionally, private browsing does not prevent websites from collecting data about you through other means, such as your IP address.

If you are concerned about your security, you should use a combination of security measures, including private browsing, a firewall, antivirus software, and a secure browser.",Support
113,HTTPS protocol could protect against phishing,"HTTPS protocol can help protect against phishing attacks, but it is not a foolproof solution. Phishing attacks are designed to trick users into entering their personal information on fake websites that look like legitimate ones. HTTPS helps to protect against phishing attacks by encrypting the traffic between the user's browser and the website, which makes it more difficult for attackers to steal data. However, phishers can still use HTTPS to create fake websites that look legitimate, so it is important to be vigilant and to look for other signs that a website may be fraudulent, such as misspellings or grammatical errors on the website.

Here are some tips to help you avoid phishing attacks:

* Be suspicious of any emails or websites that ask for your personal information, even if they appear to be from a legitimate source.
* Look for the HTTPS security certificate in the address bar of your browser. A secure website will have a green lock icon next to the URL.
* Do not click on links in emails or on websites that you are not familiar with. Instead, type the URL of the website into your browser yourself.
* Keep your software up to date. Software updates often include security patches that can help to protect your computer from phishing attacks.

By following these tips, you can help to protect yourself from phishing attacks.",Negate
114,HTTPS prevents people from seeing what their partner did on the Internet or the employer from seeing whether employees were not working when they should have been.,"HTTPS (Hypertext Transfer Protocol Secure) is a secure version of the Hypertext Transfer Protocol (HTTP). It encrypts data sent between a user's browser and a website, making it more difficult for third parties to intercept and read that data. This can help to protect sensitive information, such as passwords, credit card numbers, and medical records.

In the context of your question, HTTPS can help to prevent people from seeing what their partner did on the internet or the employer from seeing whether employees were not working when they should have been. For example, if a person is using a website that uses HTTPS to log in to their bank account, their partner would not be able to see what websites they are visiting or what they are doing on those websites. Similarly, if an employee is using a website that uses HTTPS to access their work email, their employer would not be able to see what websites they are visiting or what they are doing on those websites.

However, it is important to note that HTTPS is not a perfect solution. It can still be possible for third parties to intercept data if they have access to the user's computer or network. Additionally, HTTPS does not protect against all types of attacks, such as phishing attacks.

Overall, HTTPS can be a valuable tool for protecting sensitive information. However, it is important to understand its limitations and to take other steps to protect your privacy.

Here are some additional tips for protecting your privacy online:

* Use strong passwords and change them regularly.
* Be careful about what information you share online.
* Use a VPN when connecting to public Wi-Fi networks.
* Keep your software up to date.",Support
115,"The lock symbol puts security in people's mind with the purpose to build up trust, this does not mean anything about the security of the websites or connection.","The lock symbol is a visual cue that the connection between a user's browser and a website is secure and cannot be intercepted or monitored by outside parties. However, it does not mean anything about the security of the website itself. For example, a website with a lock symbol could still be a phishing website that is designed to steal your personal information.

Here are some other things to look for when assessing the security of a website:

* The website's URL should start with ""https://"".
* The website should have a valid SSL certificate. You can verify this by clicking on the lock symbol and looking for the name of the certificate authority that issued the certificate.
* The website should have a privacy policy that explains how it collects and uses your personal information.
* The website should use strong passwords and security measures to protect your data.

If you are still unsure about the security of a website, it is always best to err on the side of caution and not enter any personal information.

Here are some additional tips for staying safe online:

* Keep your software up to date.
* Use a strong password manager to create and store unique passwords for all of your online accounts.
* Be careful about what information you share online.
* Be suspicious of any emails or websites that ask for personal information.
* If you think you have been the victim of a cyberattack, report it to the authorities immediately.",Negate
116,"HTTPS is a bad protocol, if HTTPS were secure, I wouldn't need two-factor authentication.","No, that claim is not true. HTTPS is a secure protocol, but it is not perfect. It can be vulnerable to attacks such as man-in-the-middle attacks, which can allow attackers to intercept and modify traffic between a client and a server. Two-factor authentication adds an additional layer of security by requiring users to provide a second factor, such as a code from their phone, in addition to their password. This makes it much more difficult for attackers to gain access to accounts, even if they have stolen the user's password.

Here are some of the benefits of using HTTPS:

* HTTPS encrypts all traffic between a client and a server, making it much more difficult for attackers to intercept and read that traffic.
* HTTPS also provides authentication, which means that clients can be sure that they are communicating with the correct server.
* HTTPS is widely supported by browsers and other clients, making it easy to use.

Here are some of the limitations of HTTPS:

* HTTPS is not a perfect protocol. It can be vulnerable to attacks such as man-in-the-middle attacks.
* HTTPS can add some overhead to traffic, which can slow down performance.
* HTTPS can be expensive to implement, especially for small businesses.

Overall, HTTPS is a secure protocol that provides a number of benefits. However, it is important to be aware of its limitations and to take steps to mitigate those risks. Two-factor authentication is a great way to add an additional layer of security to your accounts and protect yourself from attackers.",Negate
117,An IoT device that receives security patches must not be secure.,"The claim ""An IoT device that receives security patches must not be secure"" is not true. In fact, the opposite is true. IoT devices that receive security patches are more secure than those that do not. This is because security patches are designed to fix vulnerabilities that could be exploited by attackers. By applying security patches, IoT device owners can help to protect their devices from being hacked.

However, it is important to note that even IoT devices that receive security patches are not 100% secure. This is because new vulnerabilities are constantly being discovered. As a result, it is important to take other steps to secure IoT devices, such as using strong passwords and enabling two-factor authentication.

Here are some tips for securing your IoT devices:

* Keep your devices up to date with the latest security patches.
* Use strong passwords and enable two-factor authentication.
* Only install apps from trusted sources.
* Be careful about what information you share with IoT devices.
* Monitor your devices for suspicious activity.

By following these tips, you can help to protect your IoT devices from being hacked.",Negate
