id,claim,answer,type
42,"My PC doesn't run Windows, so it is quite safe","The claim that ""My PC doesn't run Windows, so it is quite safe"" is not entirely true. While it is true that Windows is the most popular operating system, it is also the most targeted by malware and viruses. This is because there are simply more Windows users than any other operating system, so there is a larger market for malware developers to target.

However, this does not mean that other operating systems are immune to malware. In fact, there have been cases of malware targeting macOS, Linux, and even mobile operating systems like iOS and Android.

The best way to protect your computer from malware is to use a security suite that includes antivirus, anti-spyware, and firewall protection. You should also keep your software up to date, as software updates often include security patches that can help to protect your computer from known threats.

In addition to using security software, you should also be careful about what websites you visit and what files you download. Avoid clicking on links in emails from unknown senders, and only download files from trusted sources.

By following these simple tips, you can help to keep your computer safe from malware, regardless of what operating system you use.

Here are some additional tips for keeping your PC safe:

Use a strong password for your computer and all of your online accounts.
Enable two-factor authentication whenever possible.
Be careful about what information you share online.
Keep your software up to date.
Back up your data regularly.
Be aware of the latest threats and how to protect yourself from them.
By following these tips, you can help to keep your PC safe from malware and other online threats.",Negate
43,Malware is written by antivirus vendors,"It is not true that malware is written by antivirus vendors. Antivirus vendors have a vested interest in protecting users from malware, and writing malware would be counterproductive to that goal. In fact, antivirus vendors often work closely with law enforcement to track down and prosecute malware writers.

There are a few reasons why people might believe that malware is written by antivirus vendors. One reason is that antivirus vendors often have access to the latest malware threats. This is because they need to be able to detect and block malware as quickly as possible. However, this does not mean that antivirus vendors are the ones creating the malware. They are simply trying to stay ahead of the curve so that they can protect their users.

Another reason why people might believe that malware is written by antivirus vendors is that some antivirus vendors have been caught selling fake antivirus software. This software is designed to look like legitimate antivirus software, but it actually does nothing to protect users from malware. Instead, it simply tries to trick users into paying for it. However, this does not mean that all antivirus vendors are involved in this type of activity. There are many reputable antivirus vendors that provide high-quality protection from malware.

If you are concerned about malware, there are a few things you can do to protect yourself. First, make sure that you have a good antivirus program installed on your computer. Second, keep your software up to date. Software updates often include security patches that can help to protect your computer from malware. Third, be careful about what you click on and what you download. Only download files from trusted sources. Finally, be aware of the latest malware threats. You can learn about the latest threats by reading security blogs and newsletters.",Negate
44,Blockchain is a magical database in the cloud.,"The claim that ""blockchain does not store any type of document"" is not entirely true. It is true that blockchains do not store the actual data itself, but they do store a hash of the data. A hash is a unique identifier that is generated from the data, and it is used to verify the integrity of the data. If the data is ever changed, the hash will also change, which will alert the network that the data has been tampered with.

So, while blockchains do not store the actual data itself, they do store a hash of the data, which can be used to verify the integrity of the data. This makes blockchains a very secure way to store data, as it is very difficult to tamper with data without being detected.

Overall, blockchains are a powerful technology with a wide range of potential applications. However, it is important to understand their limitations before using them.",Negate
45,Blockchain is free,"Well, it depends.

Blockchain technology is a distributed ledger technology that allows for secure, transparent, and tamper-proof transactions. It is often used to create cryptocurrencies, but it can also be used for a variety of other applications, such as supply chain management, healthcare, and finance.

There are a number of free blockchain platforms available, such as Ethereum, Kaleido, and GetBlock. These platforms allow users to create and deploy blockchain applications without having to pay any fees. However, there are also a number of costs associated with using blockchain technology, such as the cost of computing power, storage, and bandwidth.

Overall, the cost of using blockchain technology depends on the specific application. For some applications, such as creating a cryptocurrency, the cost can be very low. For other applications, such as building a complex supply chain management system, the cost can be much higher.

So, to answer your question, ""Blockchain is free"" is not always true. The cost of using blockchain technology depends on the specific application.",Negate
46,There is only one blockchain,"No, it is not true. There are many different blockchains, each with its own unique features and applications. Some of the most popular blockchains include:

Bitcoin: The first and most well-known blockchain, Bitcoin is a decentralized digital currency that allows for peer-to-peer transactions without the need for a central authority.
Ethereum: A more general-purpose blockchain, Ethereum is used to build decentralized applications (dApps) that can run without the need for a central server.
Hyperledger Fabric: A private blockchain designed for enterprise use, Hyperledger Fabric is used to build secure and scalable distributed ledgers.
Corda: Another private blockchain, Corda is designed for financial applications and is used by many major banks.
These are just a few of the many different blockchains that are currently in use. As the technology continues to develop, we can expect to see even more blockchains emerge, each with its own unique set of features and applications.
",Negate
47,"Blockchain can be used for anything and everything, or blockchains can be used everywhere","The claim that ""Blockchain can be used for anything and everything"" is an exaggeration. While blockchain has the potential to be used in a wide variety of applications, it is not a silver bullet that can solve all problems. There are some cases where blockchain is not a good fit, such as applications that require high levels of performance or scalability.

Here are some of the pros and cons of using blockchain:

Pros:

Blockchain is a secure and transparent way to store data.
Blockchain is decentralized, which means that it is not controlled by any single entity.
Blockchain is immutable, which means that data stored on the blockchain cannot be changed without the consensus of the network.
Blockchain is efficient, as it can process transactions quickly and cheaply.
Cons:

Blockchain is a complex technology that can be difficult to understand and implement.
Blockchain requires a large amount of computing power to operate.
Blockchain is not yet widely adopted, which means that there are limited opportunities to use it.
Overall, blockchain is a promising technology with the potential to revolutionize many industries. However, it is important to be aware of the limitations of blockchain before deploying it in any application.",Negate
48,"The blockchain ledger is locked and unchangeable/ unable to modify the data block once created, or blockchain data cannot be changed once updated","Yes, the claim ""The blockchain ledger is locked and unchangeable/ unable to modify the data block once created, or blockchain data cannot be changed once updated"" is true.

Blockchain is a distributed ledger technology that allows for secure, transparent, and tamper-proof transactions. It is made up of blocks of data that are linked together using cryptography. Once a block is added to the chain, it cannot be changed or deleted. This is because each block contains a cryptographic hash of the previous block. If any data in a block is changed, the hash will be different and the block will not be accepted by the network.

This immutability is one of the key features of blockchain that makes it so secure. It means that once data is stored on the blockchain, it cannot be tampered with or deleted. This makes blockchain ideal for applications where security and transparency are essential, such as financial transactions, supply chain management, and voting.

However, it is important to note that blockchain is not completely immutable. There are some cases where data can be changed on the blockchain, such as when a bug is found in the code or when a transaction needs to be reversed. In these cases, a new block is created that contains the changes to the data. The old block is then marked as invalid and is no longer considered part of the chain.

Overall, blockchain is a very secure and tamper-proof technology. However, it is important to be aware of the limitations of immutability.",Support
49,"Blockchain records can never be hacked or changed/blockchain technology is 100% trustworthy, or blockchains are truth machines","While blockchain technology is generally very secure, it is not impossible to hack or change blockchain records. There are a number of ways this can be done, including:

51% attacks: In a 51% attack, a malicious actor gains control of more than 50% of the computing power on a blockchain network. This gives them the ability to prevent transactions from being processed or to reverse transactions that have already been processed.
Security flaws in smart contracts: Smart contracts are self-executing contracts that are stored on a blockchain. They can be used to automate a wide variety of tasks, such as transferring money or goods. However, smart contracts can also contain security flaws that can be exploited by hackers.
Human error: Human error can also lead to blockchain records being hacked or changed. For example, if a user enters their private key incorrectly, it can give a malicious actor access to their cryptocurrency wallet.
It is important to note that blockchain technology is still under development, and new security vulnerabilities are being discovered all the time. It is therefore important to take steps to protect your blockchain assets, such as using strong passwords and storing your private keys offline.

Here are some additional things to consider when evaluating the security of blockchain technology:

The type of blockchain: Some blockchains are more secure than others. For example, public blockchains, such as Bitcoin and Ethereum, are more secure than private blockchains, which are typically used by businesses.
The level of decentralization: More decentralized blockchains are generally more secure than less decentralized blockchains. This is because it is more difficult for a malicious actor to gain control of a more decentralized network.
The maturity of the blockchain: More mature blockchains are generally more secure than less mature blockchains. This is because they have had more time to be audited and patched for security vulnerabilities.
Overall, blockchain technology is a very secure way to store and transfer data. However, it is important to be aware of the potential risks and to take steps to protect your assets.",Negate
50,Blockchain is bitcoin and bitcoin is blockchain,"The claim ""Blockchain is Bitcoin and Bitcoin is Blockchain"" is not entirely true. Blockchain is the technology that powers Bitcoin, but Bitcoin is not the only use for blockchain. Blockchain can be used to store and track any type of data, not just cryptocurrency transactions. For example, blockchain can be used to track supply chains, medical records, or even votes in an election.

So, while Bitcoin is the most well-known example of blockchain, it is not the only one. Blockchain is a powerful technology with many potential applications, and Bitcoin is just one of them.",Negate
51,Blockchain is developed for big companies/ commercial communications only,"The claim that blockchain is developed for big companies/commercial communications only is not entirely true. While blockchain is often used by large corporations for its security and efficiency benefits, it can also be used by small businesses and individuals.

Here are some examples of how blockchain is being used by small businesses and individuals:

Supply chain management: Blockchain can be used to track the movement of goods and services through a supply chain, providing transparency and traceability. This can help to reduce fraud and improve efficiency.
Financial services: Blockchain can be used to create new financial products and services, such as decentralized lending and insurance. This can make financial services more accessible and affordable for everyone.
Real estate: Blockchain can be used to digitize real estate records, making them more secure and transparent. This can make it easier for people to buy, sell, and rent property.
Healthcare: Blockchain can be used to store and share medical records, making them more secure and accessible. This can improve the quality of healthcare and make it more affordable.
These are just a few examples of how blockchain is being used by small businesses and individuals. As the technology continues to develop, we can expect to see even more innovative and creative uses for blockchain in the future.",Negate
52,Smart contracts have a similar legal value to regular contracts,"Yes, smart contracts have a similar legal value to regular contracts. In most jurisdictions, smart contracts are considered to be legally binding agreements as long as they meet the same requirements as traditional contracts. These requirements typically include:

Offer and acceptance: There must be an offer from one party and an acceptance of that offer by the other party.
Consideration: Each party must provide something of value to the other party.
Mutual assent: Both parties must agree to the terms of the contract.
Legality: The contract must not violate any laws or regulations.
Once a smart contract is created, it is stored on a blockchain and cannot be changed or modified. This makes it very difficult for one party to breach the contract, as the other party can simply refer to the blockchain to see the terms of the agreement.

However, there are some potential legal challenges that could arise with smart contracts. For example, if a smart contract is used to enter into a contract that is illegal, the contract may not be enforceable. Additionally, if a smart contract is not properly written, it may be open to interpretation, which could lead to disputes.

Overall, smart contracts have the potential to revolutionize the way contracts are created and enforced. However, it is important to be aware of the potential legal challenges that could arise before using smart contracts.
",Support
53,Blockchain can store documents,"Yes, blockchain can store documents. In fact, there are a number of companies that are already using blockchain to store documents, including:

DocuSign is a leading provider of electronic signature services. The company uses blockchain to store the digital signatures of its users, which helps to ensure the authenticity and security of documents.
Everledger is a company that tracks the provenance of diamonds using blockchain. The company's platform allows buyers to verify the authenticity of diamonds and to trace their history from the mine to the retailer.
SkuChain is a company that uses blockchain to track the supply chain of goods. The company's platform allows businesses to track the movement of goods from the manufacturer to the retailer, which helps to ensure the authenticity and quality of the goods.
These are just a few examples of the many companies that are using blockchain to store documents. As the technology continues to develop, we can expect to see even more use cases for blockchain-based document storage.

Here are some of the benefits of using blockchain to store documents:

Security: Blockchain is a secure technology that is resistant to hacking and tampering. This makes it an ideal platform for storing sensitive documents, such as contracts, medical records, and financial records.
Transparency: Blockchain is a transparent technology that allows for the easy tracking of document ownership and changes. This can help to prevent fraud and ensure the integrity of documents.
Efficiency: Blockchain is an efficient technology that can help to streamline the document storage and management process. This can save businesses time and money.
Overall, blockchain is a promising technology that has the potential to revolutionize the way we store documents. As the technology continues to develop, we can expect to see even more use cases for blockchain-based document storage.",Support
54,Blockchains are intended only to aid money management,"No, that claim is not true. Blockchains are a distributed ledger technology that can be used to record any type of data, not just financial transactions. Some of the other potential uses of blockchains include:

Supply chain management: Blockchains can be used to track the movement of goods and materials through a supply chain, ensuring that they are authentic and have not been tampered with.
Healthcare: Blockchains can be used to store and share patient medical records, making it easier for doctors and other healthcare providers to access and coordinate care.
Voting: Blockchains can be used to create secure and tamper-proof voting systems, making it easier for citizens to participate in elections.
Intellectual property: Blockchains can be used to register and track intellectual property, such as patents, trademarks, and copyrights.
Government services: Blockchains can be used to streamline and improve government services, such as issuing passports, driver's licenses, and birth certificates.
These are just a few of the potential uses of blockchains. As the technology continues to develop, we can expect to see even more innovative and creative applications emerge.",Negate
55,"Blockchains consume high volumes of energy, increasing costs","Yes, it is true that some blockchains consume high volumes of energy, increasing costs. This is because the way that blockchains work requires a lot of computing power to verify transactions and add them to the ledger. This computing power is often provided by specialized computers called miners, which use a lot of energy.

The amount of energy consumed by a blockchain depends on a number of factors, including the type of consensus mechanism used, the number of transactions per second, and the price of electricity. For example, Bitcoin uses a proof-of-work consensus mechanism, which is very energy-intensive. Ethereum is transitioning to a proof-of-stake consensus mechanism, which is much more energy-efficient.

The high energy consumption of some blockchains has raised concerns about the environmental impact of this technology. However, it is important to note that not all blockchains are created equal. Some blockchains, such as those that use proof-of-stake consensus mechanisms, are much more energy-efficient than others.

As the blockchain industry continues to grow, it is important to develop more energy-efficient solutions. This will help to reduce the environmental impact of this technology and make it more sustainable in the long term.
",Support
57,Every transaction on blockchain is anonymous,"The claim that ""Every transaction on blockchain is anonymous"" is not entirely true. While blockchain transactions are not linked to any personal information, they can still be traced back to the user's identity if the user's wallet address is linked to any other identifying information. For example, if a user's wallet address is used to purchase goods or services online, the user's identity could be revealed to the merchant or service provider. Additionally, law enforcement agencies have been able to trace blockchain transactions back to users in some cases.

Therefore, while blockchain transactions offer a certain level of anonymity, they are not completely anonymous. Users should be aware of the risks of using blockchain transactions before doing so.

Here are some of the ways that blockchain transactions can be traced:

* **Wallet addresses:** Every blockchain transaction is linked to a wallet address. Wallet addresses are like public keys, and they can be used to identify the sender and recipient of a transaction.
* **Transaction history:** The blockchain stores a record of all transactions that have ever been made. This transaction history can be used to track the flow of funds between different wallet addresses.
* **Linking data:** Law enforcement agencies can use a variety of methods to link blockchain data to other sources of data, such as IP addresses, email addresses, and phone numbers. This can help them to identify the users behind blockchain transactions.

It is important to note that not all blockchains are created equal. Some blockchains, such as Monero and Zcash, are designed to be more private than others. These blockchains use techniques such as ring signatures and stealth addresses to make it more difficult to track transactions.

Ultimately, the level of anonymity that is offered by blockchain transactions depends on the specific blockchain that is being used. Users should carefully consider the risks of using blockchain transactions before doing so.",Negate
58,All blockchains are public,"No, the claim that ""All blockchains are public"" is not true. There are three main types of blockchains: public, private, and permissioned.

* **Public blockchains** are open to anyone to join and participate in. They are typically used for applications where it is important to maintain a high level of transparency and trust, such as cryptocurrencies and supply chain management.
* **Private blockchains** are owned and controlled by a single organization or group of organizations. They are typically used for applications where it is important to protect sensitive data, such as financial transactions or intellectual property.
* **Permissioned blockchains** are a hybrid of public and private blockchains. They allow anyone to join, but only certain users are allowed to participate in certain activities. This makes them a good choice for applications where it is important to balance transparency and security, such as healthcare and government records.

So, to answer your question, not all blockchains are public. There are a variety of different types of blockchains, each with its own unique set of features and benefits.",Negate
59,The transaction fee of bitcoins is determined by the bitcoin wallet provider.,"The claim ""The transaction fee of bitcoins is determined by the bitcoin wallet provider"" is not entirely true. While it is true that the wallet provider can set the default transaction fee, the user ultimately has the choice of how much they want to pay. If a user is willing to wait longer for their transaction to be processed, they can choose to pay a lower fee. However, if they want their transaction to be processed more quickly, they can choose to pay a higher fee.

The transaction fee is determined by a number of factors, including the size of the transaction, the current network congestion, and the priority that the user wants to assign to their transaction. The wallet provider can set the default transaction fee, but the user can always override this setting.

Here are some tips for reducing Bitcoin transaction fees:

* Use a smaller transaction size. The larger the transaction, the higher the fee.
* Wait for a less congested time to send your transaction. During times of high network congestion, fees are typically higher.
* Use a different wallet provider. Some wallet providers charge lower fees than others.
* Consider using a different cryptocurrency. Bitcoin transaction fees are typically higher than those of other cryptocurrencies.",Negate
60,The bitcoin transaction is reversible and can be canceled anytime.,"No, it is not true. Bitcoin transactions are irreversible and cannot be canceled once they have been broadcast to the network. This is because Bitcoin transactions are stored on a public ledger called the blockchain, which is distributed across a network of computers. Once a transaction is added to the blockchain, it cannot be removed without altering the entire blockchain, which would require a majority of the network to agree to do so.

There are a few rare cases where a Bitcoin transaction can be reversed. For example, if a transaction is sent to an incorrect address, the sender may be able to contact the recipient and ask them to return the funds. However, this is not always possible, and it is generally not recommended to rely on this method of recovering lost funds.

It is important to be careful when sending Bitcoin transactions, as once they have been sent, they cannot be reversed. If you are not sure about the recipient's address, it is always best to double-check before sending.",Negate
