id,claim,answer,type
75,A date of birth is a secure password as long as it isn't my own date of birth.,"No, the claim that ""A date of birth is a secure password as long as it isn't my own date of birth"" is not true. Dates of birth are often used as security questions, so if someone knows your date of birth, they can easily guess your password. Additionally, dates of birth are often publicly available information, so it is not difficult for hackers to find them. For these reasons, it is not a good idea to use your date of birth, or anyone else's date of birth, as a password.

Here are some tips for creating secure passwords:

* Use a combination of upper and lowercase letters, numbers, and symbols.
* Make your password at least 12 characters long.
* Avoid using personal information, such as your name, birthday, or address.
* Do not use the same password for multiple accounts.
* Consider using a password manager to help you keep track of your passwords.

By following these tips, you can create strong passwords that will help protect your accounts from hackers.",Negate
76,There is high reliability that something encrypted is going to remain untampered. It increases that reliability and the assurance that something that has not been altered or stolen or read or whatever.,"The claim that ""There is high reliability that something encrypted is going to remain untampered"" is generally true, but it is important to note that no security measure is perfect. Encryption can be very effective at protecting data from unauthorized access, but it is important to use strong encryption algorithms and to keep the encryption keys secure. If the encryption keys are compromised, then the encrypted data can be decrypted by an attacker.

There are a number of factors that can affect the reliability of encryption, including the following:

* The strength of the encryption algorithm.
* The length of the encryption key.
* The security of the encryption keys.
* The way in which the encrypted data is stored.
* The way in which the encrypted data is transmitted.

If you are concerned about the security of your data, you should use strong encryption algorithms and keep the encryption keys secure. You should also take steps to protect the encrypted data from unauthorized access, such as storing it on a secure server or encrypting it before it is transmitted over a network.

Here are some additional tips for increasing the reliability of encryption:

* Use a strong encryption algorithm. There are many different encryption algorithms available, and some are more secure than others. It is important to use a strong encryption algorithm that is difficult to crack.
* Use a long encryption key. The longer the encryption key, the more difficult it will be for an attacker to crack.
* Keep the encryption keys secure. The encryption keys are the most important part of encryption. If the encryption keys are compromised, then the encrypted data can be decrypted by an attacker. It is important to keep the encryption keys secure and to not share them with anyone.
* Protect the encrypted data from unauthorized access. Once the data is encrypted, it is important to protect it from unauthorized access. This can be done by storing the encrypted data on a secure server or by encrypting it before it is transmitted over a network.

By following these tips, you can increase the reliability of encryption and protect your data from unauthorized access.",Support
77,Text messages and emails are more secure than instant messages.,"That claim is not entirely true. It depends on the instant messaging app that you are using. Some instant messaging apps, such as Signal and WhatsApp, use end-to-end encryption, which means that your messages are scrambled and can only be read by the sender and recipient. Other instant messaging apps, such as Facebook Messenger and Skype, do not use end-to-end encryption, which means that your messages could be intercepted by someone who has access to the network.

In general, text messages and emails are more secure than instant messages that do not use end-to-end encryption. However, there are some instant messaging apps that are just as secure as text messages and emails.

Here is a table that summarizes the security of different types of messaging:

| Messaging type | Security |
|---|---|
| Text messages | Usually secure, but can be intercepted if the phone is lost or stolen |
| Emails | Usually secure, but can be intercepted if the email account is hacked |
| Instant messages (with end-to-end encryption) | Very secure, as messages can only be read by the sender and recipient |
| Instant messages (without end-to-end encryption) | Not as secure, as messages could be intercepted by someone who has access to the network |

It is important to note that even if a messaging app uses end-to-end encryption, your messages are still not completely secure. If you are sending sensitive information, such as passwords or credit card numbers, you should always use a secure connection, such as a VPN.",Negate
78,"Even if messages are end-to-end encrypted, they can also be read by third parties during transmission.","In general, end-to-end encryption (E2EE) is a very secure way to communicate. It prevents anyone who is not the sender or recipient from reading the message, even if they have access to the network that the message is traveling over. However, there are some cases where E2EE messages can be read by third parties.

One way this can happen is if the message is intercepted in transit. This can happen if the message is sent over an insecure network, such as a public Wi-Fi network. If an attacker is able to intercept the message, they can decrypt it using the encryption keys that are stored on the sender's and recipient's devices.

Another way that E2EE messages can be read by third parties is if the encryption keys are compromised. This can happen if the keys are stolen or if the devices that store the keys are hacked. If the encryption keys are compromised, anyone who has access to them can decrypt any messages that have been sent using those keys.

Finally, it is important to note that E2EE does not protect against all forms of attack. For example, if the sender or recipient is coerced into revealing the encryption keys, the message can be decrypted. Additionally, E2EE does not protect against messages that are intercepted and stored before they are sent.

Overall, E2EE is a very secure way to communicate, but it is important to be aware of the potential risks. If you are concerned about your privacy, you should take steps to protect your encryption keys and to use a secure network.

Here are some additional tips for protecting your E2EE messages:

* Use a strong password for your devices and accounts.
* Keep your devices up to date with the latest security patches.
* Be careful about what information you share online.
* Use a VPN when connecting to public Wi-Fi networks.
* Be suspicious of any emails or messages that ask for personal information.

By following these tips, you can help to protect your privacy and keep your E2EE messages safe.",Negate
79,"When I use a public Wi-Fi, other devices that are also using this Wi-Fi can generally see what data (e. g., passwords, credit card information) I enter on websites.","Yes, it is true that other devices that are also using the same public Wi-Fi network as you can generally see what data you enter on websites, such as passwords and credit card information. This is because public Wi-Fi networks are not encrypted, meaning that all data sent over the network is sent in plain text. This makes it easy for anyone on the network to intercept and view your data.

There are a few things you can do to protect your privacy when using public Wi-Fi:

* Only use websites that use HTTPS encryption. HTTPS is a secure protocol that encrypts all data sent between your device and the website. You can tell if a website uses HTTPS by looking for a lock icon in the address bar.
* Avoid entering sensitive information, such as passwords and credit card numbers, on websites that do not use HTTPS encryption.
* Use a VPN. A VPN encrypts all of your data before it is sent over the network, making it much more difficult for anyone to intercept and view your data.

By following these tips, you can help to protect your privacy when using public Wi-Fi.

Here are some additional tips for protecting your privacy on public Wi-Fi:

* Keep your software up to date. Software updates often include security patches that can help to protect your devices from malware and other threats.
* Be careful about what links you click on. Phishing attacks are a common way for hackers to steal personal information. Be careful about clicking on links in emails or on websites that you are not familiar with.
* Use a strong password manager. A password manager can help you to create and store strong passwords for all of your online accounts. This will make it more difficult for hackers to gain access to your accounts.

By following these tips, you can help to protect your privacy and security when using public Wi-Fi.",Support
80,"Private browsing would prevent hacking, as it would make the device hard to find by hackers.","No, that claim is not true. Private browsing does not prevent hacking. It only prevents your browsing history from being saved on your device. This means that other people who use your device will not be able to see what websites you have visited. However, hackers can still track your online activity in other ways, such as by using your IP address or by installing malware on your device.

Here are some of the ways that hackers can track you even when you are using private browsing:

* **IP address:** Your IP address is a unique identifier that is assigned to your device when you connect to the internet. Hackers can use your IP address to track your location and to identify you online.
* **Cookies:** Cookies are small files that are stored on your device by websites. Cookies can be used to track your browsing activity, even when you are using private browsing.
* **Malware:** Malware is a type of software that can be used to steal your personal information or to take control of your device. Hackers can install malware on your device without your knowledge, even when you are using private browsing.

If you are concerned about your online privacy, there are a few things you can do to protect yourself:

* Use a VPN (virtual private network). A VPN encrypts your traffic, making it more difficult for hackers to track your activity.
* Keep your software up to date. Software updates often include security patches that can help to protect your device from malware.
* Be careful about what websites you visit and what information you share online. Only visit websites that you trust and do not share personal information with anyone you do not know.

By following these tips, you can help to protect yourself from hackers and keep your online activity private.",Negate
81,"Private browsing mode would prevent advertisements, viruses, and tracking by both the websites visited and the network provider","No, private browsing mode does not prevent advertisements, viruses, and tracking by both the websites visited and the network provider. It only prevents your browser from saving your browsing history, cookies, site data, and form data. This means that anyone else who uses your computer will not be able to see what websites you have visited. However, websites can still track you using other methods, such as your IP address, browser fingerprint, and cookies that are not stored locally. Your network provider can also track your browsing activity, even when you are using private browsing mode.

Here are some of the things that private browsing mode does not do:

* Prevent websites from tracking you: Websites can still track you using other methods, such as your IP address, browser fingerprint, and cookies that are not stored locally.
* Prevent your network provider from tracking you: Your network provider can still track your browsing activity, even when you are using private browsing mode.
* Prevent malware from infecting your computer: Malware can still infect your computer even when you are using private browsing mode.
* Prevent you from seeing advertisements: Advertisements can still be displayed on websites when you are using private browsing mode.

If you are concerned about your privacy, you can take additional steps to protect yourself, such as using a VPN, installing an ad blocker, and being careful about what information you share online.",Negate
82,Private browsing prevents search engines from knowing my searches.,"Private browsing does not prevent search engines from knowing your searches. It only prevents your browser from storing your search history, cookies, and other browsing data locally. This means that other people who use your computer will not be able to see what you have searched for. However, the search engine itself will still be able to see your searches, as well as your IP address, which can be used to identify you.

Here are some things that private browsing does not do:

* Prevent websites from tracking your activity.
* Prevent your internet service provider from seeing your browsing activity.
* Prevent your employer or school from seeing your browsing activity.
* Prevent the government from seeing your browsing activity.

If you are concerned about your privacy, there are a number of things you can do to protect yourself, such as using a VPN, using a privacy-focused search engine, and being careful about what information you share online.

Here are some additional tips for protecting your privacy while browsing the web:

* Use a VPN. A VPN encrypts your traffic and routes it through a server in another location. This makes it much more difficult for anyone to track your online activity.
* Use a privacy-focused search engine. There are a number of search engines that do not track your searches, such as DuckDuckGo and Startpage.
* Be careful about what information you share online. Only share information that you are comfortable with being public.
* Be aware of the risks of social media. Social media platforms can track your activity and share your information with third-party companies.

By following these tips, you can help to protect your privacy while browsing the web.",Negate
83,"Websites cannot view IP addresses in private mode, thereby preventing geolocation","The claim that websites cannot view IP addresses in private mode is not entirely true. While private mode does prevent websites from storing your browsing history, cookies, and other data, it does not prevent them from seeing your IP address. Your IP address is a unique identifier that is assigned to your device when you connect to the internet. It can be used to determine your general location, such as your city or state.

While websites cannot use your IP address to track your exact location, they can use it to target you with ads or content that is relevant to your area. For example, if you are browsing for shoes in private mode, a website may still be able to show you ads for shoe stores in your area.

If you are concerned about your privacy, you can use a VPN (virtual private network) to hide your IP address. A VPN encrypts your traffic and routes it through a server in another location. This makes it difficult for websites to track your online activity.

Here are some additional tips for protecting your privacy while browsing the internet:

* Use a strong password manager to create and store unique passwords for all of your online accounts.
* Be careful about what information you share online. Only share information that you are comfortable with being public.
* Be aware of the privacy settings on your social media accounts and adjust them as needed.
* Install ad blockers and other privacy extensions on your browser.
* Be critical of the information you find online and do not click on links from unknown sources.

By following these tips, you can help to protect your privacy while browsing the internet.",Negate
84,"Even while a user was logged into a Google account, their search queries would not be saved while in private mode because private mode does not save search histories.","Yes, that claim is true. When you use private mode in Google Chrome, your search queries are not saved to your browser history or to your Google account. This means that other people who use your device will not be able to see what you have searched for, and Google will not be able to track your search history for advertising purposes.

However, it is important to note that private mode does not protect you from all forms of tracking. For example, websites can still track your activity using cookies and other tracking technologies. Additionally, your internet service provider (ISP) can still see what websites you visit, even if you are using private mode.

If you are concerned about your privacy, you can take additional steps to protect yourself, such as using a VPN or a private search engine.",Support
85,"Bookmarks saved in private mode would not persist in later sessions because private mode deletes all local, temporary data, including bookmarks.","Yes, that is true. Bookmarks saved in private mode would not persist in later sessions because private mode deletes all local, temporary data, including bookmarks. Private mode is a feature in web browsers that allows users to browse the internet without their activity being saved. This means that no history, cookies, or other data will be saved from the session. This can be useful for users who want to keep their browsing activity private or who want to test a website without affecting their regular browsing experience.

When you save a bookmark in private mode, it is not saved to your browser's bookmarks file. Instead, it is saved to a temporary file that is deleted when you close the private browsing window. This means that the bookmark will not be available in later sessions.

If you want to save a bookmark for future use, you should save it in regular browsing mode. This will ensure that the bookmark is saved to your browser's bookmarks file and will be available in later sessions.

Here are some additional details about how private mode works:

* Private mode does not save your browsing history. This means that websites you visit will not be added to your history list.
* Private mode does not save cookies. Cookies are small files that websites save on your computer. They can be used to track your browsing activity or to remember your preferences.
* Private mode does not save temporary files. Temporary files are files that websites create when you visit them. They can be used to store data such as images or videos.
* Private mode does not affect your saved passwords or other saved information. This information is stored in a different location and is not affected by private mode.

If you are concerned about your privacy, you can use private mode when browsing the internet. However, it is important to note that private mode does not offer complete privacy. Websites can still track your activity in other ways, such as by using your IP address.",Support
86,Government would need a warrant to access browsing activity from private mode.,"Yes, the government would need a warrant to access browsing activity from private mode. Private mode is a feature of web browsers that allows users to browse the web without their browsing history being saved. However, this does not mean that the government cannot access browsing activity from private mode. The government can obtain a warrant to access browsing activity from private mode if they have probable cause to believe that the activity is related to a crime.

In the United States, the Fourth Amendment to the Constitution protects citizens from unreasonable searches and seizures. This means that the government cannot search your home or belongings without a warrant. However, there are exceptions to this rule, one of which is if the government has probable cause to believe that you are involved in criminal activity.

If the government believes that you are using private mode to engage in criminal activity, they can obtain a warrant to access your browsing activity. A warrant is a court order that allows the government to search your property or belongings. To obtain a warrant, the government must show probable cause to the judge. Probable cause means that the government has a reasonable belief that you are involved in criminal activity.

If the government obtains a warrant to access your browsing activity, they can see all of the websites that you have visited, as well as the dates and times that you visited them. They can also see the search terms that you have used.

If you are concerned about the government accessing your browsing activity, you can take steps to protect your privacy. One way to do this is to use a VPN (virtual private network). A VPN encrypts your traffic, making it difficult for the government to track your online activity. You can also use a private browser, such as Tor. Tor is a free and open-source browser that routes your traffic through a series of servers, making it difficult for anyone to track your online activity.",Support
87,Employers would be unable to track employees when they used private mode.,"The claim that employers would be unable to track employees when they used private mode is not entirely true. While private mode does prevent the browser from storing cookies, browsing history, and other local data, it does not prevent the employer from tracking the employee's IP address or other identifying information. Additionally, many employers have software installed on their computers that can track employee activity, even in private mode.

Here are some ways that employers can track employees even when they are using private mode:

* **IP address:** Every device connected to the internet has a unique IP address. This address can be used to track the location of the device and the websites that it visits.
* **Website cookies:** Cookies are small files that are stored on a user's computer when they visit a website. These cookies can be used to track the user's browsing activity, even when they are using private mode.
* **Employee monitoring software:** Many employers use software to track employee activity on their computers. This software can track the websites that employees visit, the applications that they use, and even the time that they spend on each task.

If you are concerned about your privacy while using private mode, there are a few things that you can do to protect yourself:

* **Use a VPN:** A VPN encrypts your traffic and routes it through a server in another location. This makes it much more difficult for your employer to track your activity.
* **Clear your browsing history and cookies regularly:** This will help to prevent your employer from tracking your activity over time.
* **Use a different browser for personal browsing:** If you are concerned about your employer tracking your personal browsing activity, you can use a different browser for personal use. This will help to keep your personal and work browsing activity separate.

It is important to note that even if you take these steps, there is no guarantee that your employer will not be able to track you. If you are concerned about your privacy, you should talk to your employer about their policies on employee monitoring.",Negate
