id,claim,answer,type
1,"Under GDPR, controllers do not need data processing agreements with processors because the GDPR imposes direct obligations on processors","The claim that ""Under GDPR, controllers do not need data processing agreements with processors because the GDPR imposes direct obligations on processors"" is not true.

Article 28 of the GDPR requires that controllers use only processors that provide sufficient guarantees to implement appropriate technical and organizational measures in such a manner that processing will meet the requirements of this Regulation and ensure the protection of the rights of the data subject. This means that controllers must have a written contract with their processors that sets out the obligations of the processor, such as the processor's duty to comply with the GDPR, to protect personal data, and to notify the controller of any data breaches.

While the GDPR does impose direct obligations on processors, these obligations are not sufficient to ensure compliance with the GDPR. Controllers must still enter into a written contract with their processors to ensure that their processors are aware of their obligations and that they are able to meet those obligations.

Here are some of the benefits of having a DPA in place:

It can help to ensure that the processor complies with the GDPR.
It can help to protect the controller from liability in the event of a data breach.
It can provide legal certainty for both the controller and the processor.
If you are a controller, it is important to have a DPA in place with any processors that you use. This will help to ensure that you are in compliance with the GDPR and that you are protected from liability in the event of a data breach.

Sources
1. 
madhukaa.com/clean-shutdown-gfv5i/dpas-clause.html
2. 
gdpr-info.eu/art-28-gdpr/",Negate
2,"Under GDPR, when relying on consent to process personal data, consent must be explicit","Yes, it is true. Article 7 of the GDPR states that consent must be ""freely given, specific, informed and unambiguous"". This means that the data subject must be able to understand what they are consenting to, and they must be able to do so without any pressure or coercion.

Explicit consent is one way to ensure that consent is freely given. Explicit consent means that the data subject must actively agree to the processing of their personal data. This can be done by ticking a box, signing a form, or making a verbal statement.

There are some situations where explicit consent is not required. For example, consent is not required if the processing is necessary for the performance of a contract, or if the processing is necessary to protect the vital interests of the data subject or another person.

However, in most cases, businesses will need to obtain explicit consent from data subjects before processing their personal data. This is because explicit consent provides the highest level of protection for data subjects.

Here are some tips for obtaining explicit consent:

Make sure that the consent is clear and easy to understand.
Use plain language and avoid jargon.
Explain the purpose of the processing and how the data will be used.
Make sure that the consent is freely given and not coerced.
Give the data subject the opportunity to withdraw their consent at any time.
By following these tips, you can help to ensure that you are complying with the GDPR's consent requirements.",Support
3,"Under GDPR, everyone needs a data protection officer","No, it is not true that everyone needs a data protection officer (DPO) under GDPR. The GDPR requires organizations to appoint a DPO if they meet one or more of the following criteria:

They are a public authority or body.
They process large amounts of sensitive personal data.
They carry out systematic monitoring of data subjects on a large scale.
For organizations that do not meet these criteria, appointing a DPO is not mandatory, but it is still strongly recommended. A DPO can provide valuable assistance in ensuring compliance with the GDPR, and can help to protect the organization from data breaches and other privacy violations.

If you are unsure whether or not your organization needs to appoint a DPO, you should consult with a data protection lawyer or other qualified professional.",Negate
4,The GDPR will only affect organisations in Europe,"The claim that ""The GDPR will only affect organisations in Europe"" is not true. The GDPR is a regulation in the European Union that sets rules for the processing of personal data by organizations, regardless of where they are located. This means that any organization that processes personal data of EU citizens or residents, even if the organization is located outside of the EU, must comply with the GDPR.

The GDPR applies to a wide range of organizations, including businesses, governments, and non-profit organizations. It covers all aspects of the processing of personal data, from collection to storage to deletion. The GDPR also gives individuals a number of rights with respect to their personal data, including the right to access, rectify, erase, and restrict the processing of their data.

Organizations that fail to comply with the GDPR can face significant fines. The maximum fine for a single violation is ???20 million or 4% of global annual turnover, whichever is greater.

The GDPR is a complex regulation, and organizations that need to comply with it should seek professional advice. However, the GDPR is an important step in protecting the privacy of individuals in the European Union.",Negate
5,"Under GDPR, controllers and processors will only have to answer to a single data protection authority","This claim is not entirely true. Under the GDPR, controllers and processors are still subject to the laws of the countries in which they operate. However, the GDPR does provide for a one-stop shop for cross-border data transfers. This means that if a controller or processor is based in one country and processes data in another, they can only be subject to the data protection authority (DPA) in the country where they are based. This can make it easier for controllers and processors to comply with the GDPR, as they do not have to deal with multiple DPAs.

However, there are some exceptions to the one-stop shop. For example, if a controller or processor is subject to a specific legal requirement in the country where the data is processed, they may still be subject to the DPA in that country. Additionally, if a data subject makes a complaint to a DPA in another country, that DPA may still investigate the complaint.

Overall, the one-stop shop is a significant improvement over the previous data protection regime. It makes it easier for controllers and processors to comply with the GDPR and it gives data subjects more protection.",Negate
6,Biometric data are sensitive data under the GDPR,"Yes, it is true. The General Data Protection Regulation (GDPR) is a regulation in the European Union (EU) that outlines the rights of individuals with regards to their personal data and the obligations of organizations that process personal data. Under the GDPR, biometric data is considered a ""special category of personal data"". This means that it is subject to additional protections than other types of personal data.

Biometric data is any data that is derived from a person's physical or behavioral characteristics and can be used to uniquely identify that person. Examples of biometric data include fingerprints, facial scans, and voice recordings.

The GDPR considers biometric data to be sensitive because it can be used to discriminate against individuals or to track their movements or activities. For example, an employer could use biometric data to track the attendance of its employees, or a government could use it to track the movements of its citizens.

The GDPR places a number of restrictions on the processing of biometric data. Organizations that process biometric data must have a legal basis for doing so, such as consent from the individual or a legitimate interest. They must also take steps to protect the biometric data from unauthorized access, use, or disclosure.

Organizations that fail to comply with the GDPR's requirements for processing biometric data could face fines of up to ???20 million or 4% of their global annual turnover, whichever is greater.",Support
7,"Under GDPR, individuals have an absolute right to be forgotten","The claim that ""Under GDPR, individuals have an absolute right to be forgotten"" is not entirely true. The GDPR does give individuals the right to have their personal data erased, but this right is not absolute. There are a number of exceptions to the right to be forgotten, such as where the data is necessary for the performance of a public task or for the establishment, exercise or defense of legal claims.

In addition, the right to be forgotten is not a right to have all traces of an individual's personal data erased from the internet. It is only a right to have the data erased from the control of the data controller. This means that the data may still be available online, but it will not be accessible by the data controller.

The right to be forgotten is a complex right, and there is still some uncertainty about how it will be interpreted and applied in practice. However, it is clear that the GDPR gives individuals a significant new right to control their personal data.",Negate
8,"Under GDPR, parental consent is always required when collecting personal data from children","Yes, that is correct. Under the General Data Protection Regulation (GDPR), parental consent is always required when collecting personal data from children under the age of 16. This is because children are considered to be more vulnerable to the risks of data processing, and they may not be able to fully understand the implications of consenting to the processing of their personal data.

There are a few exceptions to this rule. For example, parental consent is not required if the processing of the child's personal data is necessary for the performance of a contract to which the child is party, or if the processing is necessary for the protection of the vital interests of the child. However, in all cases, the controller must take reasonable steps to verify that the child is over the age of 16 or that parental consent has been given.

The GDPR is a complex piece of legislation, and there are many nuances to the rules on parental consent. If you are unsure whether you need parental consent to collect personal data from a child, it is always best to err on the side of caution and seek legal advice.",Support
9,"Under GDPR, every business will be subject to new data portability rules","Yes, that is true. The General Data Protection Regulation (GDPR) is a regulation in the European Union (EU) that outlines the rights of individuals with respect to their personal data and the obligations of organizations that process personal data. One of the key provisions of the GDPR is the right to data portability, which gives individuals the right to receive the personal data they have provided to an organization in a structured, commonly used, and machine-readable format. They also have the right to request that the organization transmit this data directly to another organization.

The right to data portability applies to all organizations that process personal data of individuals located in the EU, regardless of whether the organization is located in the EU. This means that every business that processes personal data of EU citizens will be subject to the new data portability rules under the GDPR.

The right to data portability is intended to give individuals more control over their personal data and to make it easier for them to switch between service providers. It is also intended to promote competition in the digital economy by making it easier for businesses to compete with each other on the basis of the quality of their services, rather than on the basis of their ability to collect and store large amounts of personal data about their users.

The GDPR has been in effect since May 25, 2018. Organizations that have not yet complied with the GDPR's data portability requirements should do so as soon as possible.",Support
10,"Under GDPR, profiling activities always require consent","The claim that ""Under GDPR, profiling activities always require consent"" is not entirely true. GDPR does require consent for profiling in some cases, but there are other lawful grounds for profiling as well.

Article 6 of the GDPR sets out the lawful grounds for processing personal data. One of these lawful grounds is consent. Consent must be freely given, specific, informed, and unambiguous. It must also be given for a specific purpose.

Profiling is the automated processing of personal data to evaluate certain personal aspects relating to a natural person, such as their performance at work, economic situation, health, personal preferences, interests, reliability, behavior, location or movements.

If you are profiling someone's personal data, you will need to have a lawful ground for doing so. If you are profiling someone's personal data for the purpose of making a decision about them that has a significant impact on them, you will need to have their consent. However, if you are profiling someone's personal data for other purposes, such as marketing or fraud prevention, you may be able to rely on another lawful ground, such as legitimate interests.

If you are unsure whether you need consent for profiling, you should seek legal advice.",Negate
11,Pseudonymised data (eg hashed data) are treated exactly like any other personal data under the GDPR,"The claim that pseudonymised data (e.g. hashed data) are treated exactly like any other personal data under the GDPR is not entirely true. While pseudonymised data is still considered personal data under the GDPR, it does offer some advantages over non-pseudonymised data. For example, pseudonymised data can be shared more easily without compromising the privacy of individuals. Additionally, pseudonymised data can be used for research and other purposes without the need for consent from individuals.

However, it is important to note that pseudonymised data can still be re-identified, and therefore it is important to take steps to protect the privacy of individuals whose data is pseudonymised. For example, organizations should use strong encryption and other security measures to protect pseudonymised data. Additionally, organizations should have clear policies in place for how pseudonymised data is to be used and shared.

Overall, pseudonymisation is a valuable tool for protecting the privacy of individuals while still allowing organizations to share and use data. However, it is important to take steps to protect the privacy of individuals whose data is pseudonymised.

Here are some additional details about the GDPR's requirements for pseudonymised data:

Pseudonymised data must be processed in a way that does not allow individuals to be identified.
Organizations must take steps to protect the privacy of individuals whose data is pseudonymised.
Organizations must have clear policies in place for how pseudonymised data is to be used and shared.
If you have any questions about the GDPR's requirements for pseudonymised data, please contact your organization's data protection officer.",Negate
12,The GDPR will reduce paperwork for organisations as the notification requirement will be scrapped,"No, it is not true. The GDPR does not scrap the notification requirement for data breaches. In fact, it strengthens it. Under the GDPR, organizations are required to report data breaches to the supervisory authority within 72 hours of becoming aware of them. This is in contrast to the previous Data Protection Directive, which did not have a specific deadline for reporting data breaches.

The GDPR's notification requirement is designed to help protect individuals whose data has been compromised. By requiring organizations to report data breaches quickly, the GDPR helps to ensure that individuals can take steps to mitigate the risks associated with their data being exposed.

The GDPR's notification requirement may add some paperwork for organizations, but it is an important step in protecting the privacy of individuals.",Negate
13,"Since my organisation is compliant under the Directive, there will not be too much work involved in becoming GDPR compliant","The claim that an organization that is compliant with the Data Protection Directive (Directive) is already compliant with the General Data Protection Regulation (GDPR) is not entirely true. While there is a lot of overlap between the two regulations, there are also some key differences.

For example, the GDPR introduces a number of new rights for individuals, such as the right to be forgotten and the right to data portability. It also increases the fines for non-compliance. As a result, organizations that are already compliant with the Directive may need to make some changes in order to fully comply with the GDPR.

The amount of work involved in becoming GDPR compliant will vary depending on the size and complexity of the organization, as well as the nature of the data it collects and processes. However, it is important to note that the GDPR is a complex regulation, and organizations should not underestimate the amount of work involved in becoming compliant.

Here are some tips for organizations that are already compliant with the Directive but need to become GDPR compliant:

Start by reviewing your current privacy policies and procedures to make sure they meet the requirements of the GDPR.
Identify any areas where your organization needs to make changes in order to comply with the GDPR, such as implementing new security measures or providing additional information to individuals about how their data is being used.
Develop a plan for implementing these changes and communicate them to your employees and customers.
Monitor your compliance on an ongoing basis and make changes as needed.
By following these tips, organizations can minimize the amount of work involved in becoming GDPR compliant and ensure that they are protecting the privacy of their customers and employees.
",Negate
15,"The UK has voted to leave the EU, so there is no need to worry about the GDPR","The claim that the UK has voted to leave the EU, so there is no need to worry about the GDPR is not entirely true. While the UK is no longer a member of the EU, it has retained the GDPR in its domestic law as the UK GDPR. This means that businesses in the UK are still subject to the same data protection requirements as they were before Brexit.

However, there are some changes to how the GDPR applies in the UK after Brexit. For example, the UK is no longer subject to the EU's oversight of the GDPR, and it is free to make its own changes to the law in the future. Additionally, the UK has negotiated an adequacy agreement with the EU, which means that personal data can continue to flow freely between the two jurisdictions.

Overall, the GDPR still applies in the UK after Brexit, but there are some changes to how it applies. Businesses in the UK should be aware of these changes and take steps to ensure that they are still compliant with the GDPR.

Here are some additional details about the changes to the GDPR after Brexit:

The UK is no longer subject to the EU's oversight of the GDPR. This means that the UK's Information Commissioner's Office (ICO) is now responsible for enforcing the GDPR in the UK.
The UK is free to make its own changes to the GDPR in the future. However, the UK has committed to maintaining the same level of data protection as the GDPR.
The UK has negotiated an adequacy agreement with the EU. This means that personal data can continue to flow freely between the two jurisdictions.
Businesses in the UK should be aware of these changes and take steps to ensure that they are still compliant with the GDPR. The ICO has published a guide on the GDPR after Brexit, which provides more information on the changes.
",Negate
19,Self-driving cars are controlled by classical computer algorithms (if-then rules),"No, that claim is not true. Self-driving cars are controlled by a combination of classical computer algorithms and machine learning algorithms. Classical computer algorithms are used to process sensor data and make basic decisions about the car's surroundings, such as identifying objects and tracking their movements. Machine learning algorithms are used to learn from data and make more complex decisions, such as predicting the behavior of other drivers and planning the car's route.

The use of machine learning is essential for self-driving cars to be able to handle the complex and unpredictable nature of driving. For example, a machine learning algorithm can be trained to recognize different types of road signs, even if they are obscured or damaged. It can also be trained to predict the behavior of other drivers, even if they are making unexpected or dangerous moves.

Classical computer algorithms are still necessary for self-driving cars, but they are not sufficient. Machine learning algorithms are essential for self-driving cars to be able to learn and adapt to the ever-changing environment.",Negate
23,Self-driving cars will increase congestion in cities,"Whether self-driving cars will increase congestion in cities is a complex question with no easy answer. There are a number of factors that could contribute to either increased or decreased congestion, and the overall impact is likely to vary depending on the specific city and its transportation infrastructure.

Some experts believe that self-driving cars could actually help to reduce congestion. For example, self-driving cars could be programmed to drive more efficiently, such as by maintaining a consistent speed and distance from other vehicles. They could also communicate with each other to coordinate their movements, which could further improve traffic flow. In addition, self-driving cars could potentially be used to provide ride-hailing or taxi services, which could reduce the number of personal vehicles on the road.

However, other experts believe that self-driving cars could actually increase congestion. For example, if people are no longer required to drive themselves, they may be more likely to make trips that they would not otherwise make. This could lead to an increase in the number of vehicles on the road, which could contribute to congestion. In addition, if self-driving cars are owned by fleets rather than individuals, they may be more likely to be used for short trips, which could also contribute to congestion.

Ultimately, the impact of self-driving cars on congestion is likely to be a complex mix of both positive and negative effects. The overall impact will depend on a number of factors, including the specific design of the self-driving cars, the way in which they are used, and the overall transportation infrastructure of the city.",Noncommittal
24,Data privacy impedes IoT innovation and implies that IoT data cannot be collected,"The claim that ""Data privacy impedes IoT innovation and implies that IoT data cannot be collected"" is not entirely true. While data privacy concerns can certainly slow down the adoption of IoT technologies, it is not impossible to collect and use IoT data in a way that protects people's privacy.

There are a number of ways to address data privacy concerns in the context of IoT. For example, companies can:

Get users' consent before collecting or using their data. This can be done through clear and concise privacy policies that are easy for users to understand.
Encrypt data in transit and at rest. This will make it more difficult for unauthorized individuals to access or steal data.
Use strong security measures to protect data from unauthorized access, use, or disclosure. This includes things like firewalls, intrusion detection systems, and access control lists.
Give users control over their data. This includes the ability to see what data is being collected, how it is being used, and to request that it be deleted.
By taking these steps, companies can collect and use IoT data in a way that protects people's privacy and still innovate with new technologies.

It is important to note that there is a balance between data privacy and IoT innovation. On the one hand, people have a right to privacy and should not have their data collected or used without their consent. On the other hand, IoT technologies can offer a number of benefits to society, such as improved safety, efficiency, and convenience.

It is up to companies and governments to find a way to strike a balance between these two important interests.",Negate
